<?xml version="1.0" encoding="UTF-8"?>
<!DOCTYPE rules PUBLIC "-//RIS Dev//DTD RIS Tagging rules//EN" "ris_rules.dtd">
<rules>
    <rule type="addRISInfo" action="apply"/>
    <rule type="addPMID" action="apply"/>
    <rule type="linkDrug" action="apply"/>
    <rule type="linkDisease" action="apply"/>
    <rule type="linkKeyword" action="apply"/>
    <rule type="addRISIndex1" action="apply"/>
    <rule type="loadContent" action="apply"/>
</rules>
